{
  "schema_version": 1,
  "kind": "acoustic",
  "node": "example-synthetic",
  "firmware": "apiary_ears 1.0.0",
  "label": "inspection",
  "notes": "SYNTHETIC EXAMPLE - generated to show the file shape. Not a real recording. Do not train on this.",
  "bands_hz": [
    60,
    100,
    140,
    180,
    225,
    270,
    315,
    360,
    420,
    500,
    600,
    800
  ],
  "nose_steps_c": [
    320,
    100,
    100,
    100,
    200,
    200,
    200,
    320,
    320,
    320
  ],
  "score_weights": {
    "fanning": 0.25,
    "agitation": 0.35,
    "piping": 0.3,
    "environment": 0.1
  },
  "minutes": [
    {
      "epoch": 1789048800,
      "score": 9,
      "nose_mean_kohm": 186,
      "temp_c": 34.5,
      "rh": 58.2,
      "band_db": [
        66.4,
        67.7,
        72.1,
        69.6,
        70.1,
        71.0,
        66.2,
        67.1,
        68.6,
        70.5,
        62.1,
        64.6
      ]
    },
    {
      "epoch": 1789048860,
      "score": 11,
      "nose_mean_kohm": 187,
      "temp_c": 34.3,
      "rh": 60.6,
      "band_db": [
        72.8,
        72.6,
        68.8,
        71.4,
        65.9,
        64.2,
        70.3,
        61.7,
        63.3,
        63.9,
        61.4,
        66.6
      ]
    },
    {
      "epoch": 1789048920,
      "score": 13,
      "nose_mean_kohm": 183,
      "temp_c": 34.8,
      "rh": 59.5,
      "band_db": [
        67.0,
        68.9,
        66.5,
        67.3,
        76.0,
        75.9,
        74.1,
        69.5,
        64.8,
        63.8,
        64.5,
        61.8
      ]
    },
    {
      "epoch": 1789048980,
      "score": 9,
      "nose_mean_kohm": 183,
      "temp_c": 34.9,
      "rh": 61.0,
      "band_db": [
        72.5,
        71.2,
        61.0,
        66.5,
        74.9,
        69.6,
        75.8,
        65.8,
        61.9,
        68.6,
        70.3,
        64.2
      ]
    },
    {
      "epoch": 1789049040,
      "score": 9,
      "nose_mean_kohm": 183,
      "temp_c": 33.8,
      "rh": 59.1,
      "band_db": [
        62.4,
        64.0,
        62.2,
        64.7,
        73.6,
        66.1,
        70.7,
        66.4,
        63.3,
        69.8,
        62.6,
        68.7
      ]
    },
    {
      "epoch": 1789049100,
      "score": 13,
      "nose_mean_kohm": 183,
      "temp_c": 33.9,
      "rh": 58.3,
      "band_db": [
        72.7,
        70.6,
        64.6,
        74.6,
        66.5,
        68.7,
        74.3,
        68.7,
        62.2,
        72.9,
        63.6,
        64.1
      ]
    },
    {
      "epoch": 1789049160,
      "score": 13,
      "nose_mean_kohm": 187,
      "temp_c": 33.9,
      "rh": 58.8,
      "band_db": [
        62.1,
        68.0,
        63.9,
        71.2,
        68.5,
        69.4,
        75.5,
        66.8,
        67.9,
        71.4,
        63.2,
        62.8
      ]
    },
    {
      "epoch": 1789049220,
      "score": 10,
      "nose_mean_kohm": 187,
      "temp_c": 34.4,
      "rh": 59.2,
      "band_db": [
        69.9,
        72.3,
        63.4,
        75.4,
        74.6,
        71.2,
        69.1,
        62.2,
        61.5,
        72.6,
        63.9,
        69.5
      ]
    },
    {
      "epoch": 1789049280,
      "score": 11,
      "nose_mean_kohm": 180,
      "temp_c": 33.8,
      "rh": 59.5,
      "band_db": [
        63.1,
        69.6,
        61.8,
        66.7,
        70.7,
        74.2,
        71.4,
        64.4,
        72.0,
        63.4,
        61.2,
        64.2
      ]
    },
    {
      "epoch": 1789049340,
      "score": 12,
      "nose_mean_kohm": 188,
      "temp_c": 33.5,
      "rh": 60.5,
      "band_db": [
        67.9,
        62.6,
        65.3,
        74.7,
        75.8,
        71.9,
        72.3,
        68.0,
        62.7,
        61.4,
        61.2,
        71.9
      ]
    },
    {
      "epoch": 1789049400,
      "score": 10,
      "nose_mean_kohm": 185,
      "temp_c": 34.9,
      "rh": 61.5,
      "band_db": [
        66.8,
        69.8,
        64.8,
        76.0,
        64.9,
        70.6,
        72.8,
        71.8,
        69.8,
        69.4,
        70.5,
        72.0
      ]
    },
    {
      "epoch": 1789049460,
      "score": 12,
      "nose_mean_kohm": 183,
      "temp_c": 34.6,
      "rh": 60.3,
      "band_db": [
        66.0,
        70.5,
        71.4,
        70.9,
        71.5,
        68.6,
        71.0,
        68.3,
        62.0,
        68.7,
        72.9,
        71.6
      ]
    },
    {
      "epoch": 1789049520,
      "score": 10,
      "nose_mean_kohm": 180,
      "temp_c": 34.0,
      "rh": 60.7,
      "band_db": [
        66.3,
        71.1,
        62.0,
        73.0,
        64.4,
        71.2,
        69.8,
        63.8,
        69.4,
        67.0,
        68.4,
        72.0
      ]
    },
    {
      "epoch": 1789049580,
      "score": 13,
      "nose_mean_kohm": 183,
      "temp_c": 34.4,
      "rh": 59.3,
      "band_db": [
        63.4,
        63.0,
        71.9,
        71.9,
        69.3,
        74.7,
        67.9,
        69.0,
        63.4,
        66.2,
        70.7,
        72.0
      ]
    },
    {
      "epoch": 1789049640,
      "score": 12,
      "nose_mean_kohm": 184,
      "temp_c": 34.0,
      "rh": 61.4,
      "band_db": [
        62.6,
        67.0,
        71.0,
        74.2,
        72.5,
        75.4,
        67.3,
        63.0,
        66.4,
        64.3,
        63.6,
        66.0
      ]
    },
    {
      "epoch": 1789049700,
      "score": 11,
      "nose_mean_kohm": 180,
      "temp_c": 34.7,
      "rh": 58.9,
      "band_db": [
        72.8,
        66.4,
        61.9,
        64.4,
        74.5,
        64.5,
        72.5,
        67.8,
        64.7,
        70.5,
        61.2,
        62.6
      ]
    },
    {
      "epoch": 1789049760,
      "score": 8,
      "nose_mean_kohm": 184,
      "temp_c": 34.6,
      "rh": 58.7,
      "band_db": [
        62.7,
        61.6,
        68.6,
        69.4,
        71.6,
        71.9,
        73.7,
        72.5,
        69.2,
        63.4,
        66.7,
        63.1
      ]
    },
    {
      "epoch": 1789049820,
      "score": 9,
      "nose_mean_kohm": 184,
      "temp_c": 34.4,
      "rh": 61.6,
      "band_db": [
        64.3,
        65.1,
        69.4,
        70.2,
        71.4,
        73.1,
        68.7,
        70.5,
        71.9,
        62.0,
        72.2,
        69.7
      ]
    },
    {
      "epoch": 1789049880,
      "score": 9,
      "nose_mean_kohm": 187,
      "temp_c": 35.0,
      "rh": 61.9,
      "band_db": [
        65.5,
        67.8,
        71.6,
        73.6,
        75.3,
        69.6,
        71.8,
        63.5,
        69.7,
        70.8,
        68.7,
        69.6
      ]
    },
    {
      "epoch": 1789049940,
      "score": 13,
      "nose_mean_kohm": 181,
      "temp_c": 34.7,
      "rh": 58.7,
      "band_db": [
        67.4,
        70.5,
        64.8,
        74.9,
        74.3,
        68.2,
        65.0,
        66.3,
        67.6,
        70.2,
        66.8,
        61.3
      ]
    },
    {
      "epoch": 1789050000,
      "score": 9,
      "nose_mean_kohm": 184,
      "temp_c": 33.9,
      "rh": 60.9,
      "band_db": [
        65.0,
        70.5,
        62.7,
        65.8,
        70.2,
        72.7,
        74.1,
        69.3,
        72.3,
        66.9,
        72.4,
        62.0
      ]
    },
    {
      "epoch": 1789050060,
      "score": 11,
      "nose_mean_kohm": 182,
      "temp_c": 34.3,
      "rh": 60.0,
      "band_db": [
        68.7,
        67.3,
        71.1,
        70.7,
        67.7,
        68.6,
        74.1,
        71.8,
        63.5,
        71.2,
        72.6,
        67.3
      ]
    },
    {
      "epoch": 1789050120,
      "score": 14,
      "nose_mean_kohm": 187,
      "temp_c": 33.9,
      "rh": 59.9,
      "band_db": [
        68.3,
        61.3,
        72.6,
        70.2,
        68.8,
        73.6,
        70.8,
        66.9,
        69.3,
        61.8,
        67.5,
        66.0
      ]
    },
    {
      "epoch": 1789050180,
      "score": 9,
      "nose_mean_kohm": 182,
      "temp_c": 34.5,
      "rh": 59.3,
      "band_db": [
        62.5,
        66.2,
        70.8,
        74.8,
        69.7,
        67.8,
        66.3,
        68.4,
        72.1,
        62.6,
        70.4,
        61.3
      ]
    },
    {
      "epoch": 1789050240,
      "score": 11,
      "nose_mean_kohm": 181,
      "temp_c": 33.8,
      "rh": 60.5,
      "band_db": [
        65.3,
        68.4,
        62.3,
        72.8,
        65.5,
        70.1,
        67.0,
        63.4,
        67.4,
        66.2,
        65.5,
        66.0
      ]
    },
    {
      "epoch": 1789050300,
      "score": 9,
      "nose_mean_kohm": 188,
      "temp_c": 34.8,
      "rh": 58.5,
      "band_db": [
        68.7,
        67.4,
        71.2,
        71.3,
        74.3,
        66.8,
        72.9,
        70.7,
        71.8,
        64.8,
        64.8,
        72.1
      ]
    },
    {
      "epoch": 1789050360,
      "score": 12,
      "nose_mean_kohm": 187,
      "temp_c": 35.0,
      "rh": 58.5,
      "band_db": [
        63.9,
        69.7,
        64.1,
        65.2,
        74.0,
        69.1,
        73.5,
        62.5,
        65.8,
        69.2,
        61.2,
        63.4
      ]
    },
    {
      "epoch": 1789050420,
      "score": 9,
      "nose_mean_kohm": 182,
      "temp_c": 34.8,
      "rh": 62.0,
      "band_db": [
        67.1,
        70.1,
        67.0,
        72.2,
        66.3,
        64.8,
        65.3,
        61.4,
        67.6,
        67.2,
        67.8,
        62.8
      ]
    },
    {
      "epoch": 1789050480,
      "score": 12,
      "nose_mean_kohm": 187,
      "temp_c": 33.8,
      "rh": 59.8,
      "band_db": [
        72.1,
        62.1,
        61.7,
        75.4,
        69.5,
        73.2,
        67.9,
        66.6,
        67.2,
        66.2,
        68.2,
        61.2
      ]
    },
    {
      "epoch": 1789050540,
      "score": 12,